{
  "campaign": "bosch-grid-preflight-v1",
  "checkpoint": {
    "path": "evidence/numerical/bosch_grid_preflight_checkpoint.npz",
    "sha256": "798e68dfdeab61e556864950e36f2a1ebeecfcbc90175ed58c73eb01cd11cbd1"
  },
  "cycles": [
    {
      "assumed_band_result": {
        "checks": {
          "bow": true,
          "depth": false,
          "width": true
        },
        "inside_all": false
      },
      "availability": "complete",
      "cycle": 0,
      "mask_remaining_height": 0.2999,
      "metrics": {
        "cd_bottom": 0.29454400143881243,
        "cd_max": 0.32158803195628827,
        "cd_middle": 0.31368256208018086,
        "cd_min": 0.29454400143881243,
        "cd_top": 0.31787680043416816,
        "depth": 0.03330021908693842,
        "max_bow": 0.004271831352294864,
        "max_cd_error": 0.02158803195628828,
        "maximum_center_shift": 5.208185496174966e-05,
        "scallop_rms": 0.00022205014296273974,
        "sidewall_angle_deg": 25.038220256979812
      },
      "minimum_width_cells": 58.90880028776248,
      "reason_codes": []
    },
    {
      "assumed_band_result": {
        "checks": {
          "bow": true,
          "depth": false,
          "width": true
        },
        "inside_all": false
      },
      "availability": "complete",
      "cycle": 1,
      "mask_remaining_height": 0.2999,
      "metrics": {
        "cd_bottom": 0.28803868104924013,
        "cd_max": 0.32979916015092026,
        "cd_middle": 0.3277001430966413,
        "cd_min": 0.28803868104924013,
        "cd_top": 0.32007567708082674,
        "depth": 0.08833318824069335,
        "max_bow": 0.012411248292475946,
        "max_cd_error": 0.029799160150920267,
        "maximum_center_shift": 0.0011710566095739366,
        "scallop_rms": 0.001667795635364993,
        "sidewall_angle_deg": 13.592615953337377
      },
      "minimum_width_cells": 57.60773620984803,
      "reason_codes": []
    },
    {
      "assumed_band_result": {
        "checks": {
          "bow": true,
          "depth": false,
          "width": true
        },
        "inside_all": false
      },
      "availability": "complete",
      "cycle": 2,
      "mask_remaining_height": 0.2998821447170935,
      "metrics": {
        "cd_bottom": 0.2856981075807259,
        "cd_max": 0.3297632103774584,
        "cd_middle": 0.32098265209475907,
        "cd_min": 0.2856981075807259,
        "cd_top": 0.3161463567967705,
        "depth": 0.14234338123443485,
        "max_bow": 0.016163276712891556,
        "max_cd_error": 0.029763210377458438,
        "maximum_center_shift": 0.001170933888923656,
        "scallop_rms": 0.003095132276750829,
        "sidewall_angle_deg": 8.115926287530744
      },
      "minimum_width_cells": 57.139621516145176,
      "reason_codes": []
    },
    {
      "assumed_band_result": {
        "checks": {
          "bow": true,
          "depth": false,
          "width": true
        },
        "inside_all": false
      },
      "availability": "complete",
      "cycle": 3,
      "mask_remaining_height": 0.29974849691107286,
      "metrics": {
        "cd_bottom": 0.28575907915332655,
        "cd_max": 0.3298210371538417,
        "cd_middle": 0.32099571426022566,
        "cd_min": 0.28575907915332655,
        "cd_top": 0.3104819544078177,
        "depth": 0.1954420857958039,
        "max_bow": 0.017652743468130783,
        "max_cd_error": 0.029821037153841712,
        "maximum_center_shift": 0.0011760078605981272,
        "scallop_rms": 0.003417209727757091,
        "sidewall_angle_deg": 4.820431138663692
      },
      "minimum_width_cells": 57.151815830665306,
      "reason_codes": []
    },
    {
      "assumed_band_result": {
        "checks": {
          "bow": true,
          "depth": false,
          "width": true
        },
        "inside_all": false
      },
      "availability": "complete",
      "cycle": 4,
      "mask_remaining_height": 0.29969258809349114,
      "metrics": {
        "cd_bottom": 0.28657830694286895,
        "cd_max": 0.32953446140319376,
        "cd_middle": 0.3281560680500516,
        "cd_min": 0.28657830694286895,
        "cd_top": 0.3138099853832222,
        "depth": 0.24795301514442863,
        "max_bow": 0.018190540884508305,
        "max_cd_error": 0.029534461403193768,
        "maximum_center_shift": 0.0011371336281277011,
        "scallop_rms": 0.0031400262115767476,
        "sidewall_angle_deg": 4.187570532768308
      },
      "minimum_width_cells": 57.31566138857379,
      "reason_codes": []
    },
    {
      "assumed_band_result": {
        "checks": {
          "bow": true,
          "depth": false,
          "width": true
        },
        "inside_all": false
      },
      "availability": "complete",
      "cycle": 5,
      "mask_remaining_height": 0.2995497580738867,
      "metrics": {
        "cd_bottom": 0.2883475286011046,
        "cd_max": 0.3297208853035674,
        "cd_middle": 0.3131186754524841,
        "cd_min": 0.2883475286011046,
        "cd_top": 0.32407425013199476,
        "depth": 0.2990267154943372,
        "max_bow": 0.017077794385270323,
        "max_cd_error": 0.029720885303567424,
        "maximum_center_shift": 0.0010718471083545206,
        "scallop_rms": 0.003024525839208328,
        "sidewall_angle_deg": 4.554058772628965
      },
      "minimum_width_cells": 57.66950572022091,
      "reason_codes": []
    },
    {
      "assumed_band_result": {
        "checks": {
          "bow": true,
          "depth": false,
          "width": true
        },
        "inside_all": false
      },
      "availability": "complete",
      "cycle": 6,
      "mask_remaining_height": 0.2994783932354786,
      "metrics": {
        "cd_bottom": 0.29009201542103735,
        "cd_max": 0.329842333887554,
        "cd_middle": 0.3264488302411363,
        "cd_min": 0.29009201542103735,
        "cd_top": 0.329842333887554,
        "depth": 0.35029952350291665,
        "max_bow": 0.01588742653444683,
        "max_cd_error": 0.02984233388755403,
        "maximum_center_shift": 0.0007065985294721494,
        "scallop_rms": 0.0029453598257889913,
        "sidewall_angle_deg": 4.326194146905425
      },
      "minimum_width_cells": 58.01840308420747,
      "reason_codes": []
    },
    {
      "assumed_band_result": {
        "checks": {
          "bow": true,
          "depth": false,
          "width": true
        },
        "inside_all": false
      },
      "availability": "complete",
      "cycle": 7,
      "mask_remaining_height": 0.2994361665607957,
      "metrics": {
        "cd_bottom": 0.2923689099345883,
        "cd_max": 0.3304789292759879,
        "cd_middle": 0.3252541332895672,
        "cd_min": 0.2923689099345883,
        "cd_top": 0.32912230026552575,
        "depth": 0.4003664142636448,
        "max_bow": 0.016359761046431026,
        "max_cd_error": 0.030478929275987887,
        "maximum_center_shift": 0.0008248289031387718,
        "scallop_rms": 0.002950901678881249,
        "sidewall_angle_deg": 3.502110291199827
      },
      "minimum_width_cells": 58.47378198691766,
      "reason_codes": []
    },
    {
      "assumed_band_result": {
        "checks": {
          "bow": true,
          "depth": false,
          "width": true
        },
        "inside_all": false
      },
      "availability": "complete",
      "cycle": 8,
      "mask_remaining_height": 0.29926126080198756,
      "metrics": {
        "cd_bottom": 0.2985648815065925,
        "cd_max": 0.33219624341710213,
        "cd_middle": 0.32471790651336985,
        "cd_min": 0.2985648815065925,
        "cd_top": 0.32749852956156905,
        "depth": 0.4475208099938704,
        "max_bow": 0.014886771084923062,
        "max_cd_error": 0.032196243417102144,
        "maximum_center_shift": 0.0006247951343780617,
        "scallop_rms": 0.0028277234871411736,
        "sidewall_angle_deg": 2.4680423399254385
      },
      "minimum_width_cells": 59.7129763013185,
      "reason_codes": []
    },
    {
      "assumed_band_result": {
        "checks": {
          "bow": true,
          "depth": false,
          "width": true
        },
        "inside_all": false
      },
      "availability": "complete",
      "cycle": 9,
      "mask_remaining_height": 0.2991476221220509,
      "metrics": {
        "cd_bottom": 0.3024800403410508,
        "cd_max": 0.3320876841572715,
        "cd_middle": 0.3294805368644097,
        "cd_min": 0.3024800403410508,
        "cd_top": 0.3248882001820551,
        "depth": 0.49416633546653776,
        "max_bow": 0.012608276629605952,
        "max_cd_error": 0.032087684157271534,
        "maximum_center_shift": 0.0006942746960600932,
        "scallop_rms": 0.002672706960800982,
        "sidewall_angle_deg": 1.7315385593254211
      },
      "minimum_width_cells": 60.49600806821016,
      "reason_codes": []
    },
    {
      "assumed_band_result": {
        "checks": {
          "bow": true,
          "depth": false,
          "width": true
        },
        "inside_all": false
      },
      "availability": "complete",
      "cycle": 10,
      "mask_remaining_height": 0.29904539662945484,
      "metrics": {
        "cd_bottom": 0.3058637172642721,
        "cd_max": 0.3322710714106574,
        "cd_middle": 0.3226162880066573,
        "cd_min": 0.3058637172642721,
        "cd_top": 0.3210841912157448,
        "depth": 0.5395512585125212,
        "max_bow": 0.010869871067300196,
        "max_cd_error": 0.03227107141065744,
        "maximum_center_shift": 0.0007697873162277602,
        "scallop_rms": 0.0025624690508214303,
        "sidewall_angle_deg": 1.0773967156905482
      },
      "minimum_width_cells": 61.17274345285441,
      "reason_codes": []
    },
    {
      "assumed_band_result": {
        "checks": {
          "bow": true,
          "depth": false,
          "width": true
        },
        "inside_all": false
      },
      "availability": "complete",
      "cycle": 11,
      "mask_remaining_height": 0.298593637669757,
      "metrics": {